{
  "$schema": "../asset-spec.schema.json",
  "schemaVersion": 1,
  "assetId": "field-plough-01",
  "displayName": "Field Plough 01",
  "assetFamily": "rig-part",
  "lifecycle": {
    "status": "procedural-candidate",
    "runtimeAdmission": "available-for-development-and-open-world-review; refinement-open",
    "publicApproved": false,
    "owner": "Rigs Unbound asset lane"
  },
  "references": [
    {
      "path": "assets/generated/field-plough-01-object-reference-2026-07-29.png",
      "role": "primary isolated appearance reference",
      "evidenceTier": 1,
      "confidence": 0.82,
      "notes": "Strong silhouette and material evidence; hidden geometry and dimensions remain uncertain."
    },
    {
      "path": "assets/workbench/field-plough-01/detail-inventory.json",
      "role": "observed detail inventory",
      "evidenceTier": 2,
      "confidence": 0.86,
      "notes": "Twelve details are mapped in the workbench; the generated img2threejs spec is derived evidence, not this definition's authority."
    },
    {
      "path": "assets/workbench/field-plough-01/pbr-painted-steel-report.json",
      "role": "reference-derived painted-steel PBR evidence",
      "evidenceTier": 2,
      "confidence": 0.86,
      "notes": "Inference from source pixels, not inverse rendering or measured material truth."
    }
  ],
  "identity": {
    "role": "Three-point field implement for cutting and turning soil.",
    "functionalVerbs": [
      "attach",
      "raise",
      "lower",
      "cut",
      "turn-soil",
      "detach",
      "inspect"
    ],
    "silhouette": {
      "formLanguage": "hard-surface articulated agricultural implement",
      "dominantMasses": [
        "wide horizontal cross-beam",
        "triangular top-link frame",
        "repeated curved shares"
      ],
      "negativeSpaces": [
        "open triangle below top-link bracket",
        "gaps between shares",
        "hydraulic-ram clearance"
      ],
      "identityFeatures": [
        "three-point attachment frame",
        "repeated share system",
        "central hydraulic ram",
        "bright cutting edges",
        "dark worn steel with soil residue"
      ]
    },
    "dimensions": {
      "widthMeters": {
        "value": 3.8,
        "confidence": 0.35,
        "status": "provisional-authoring-hypothesis"
      },
      "heightMeters": {
        "value": 1.8,
        "confidence": 0.3,
        "status": "provisional-authoring-hypothesis"
      },
      "depthMeters": {
        "value": 1.35,
        "confidence": 0.3,
        "status": "provisional-authoring-hypothesis"
      },
      "measurementNote": "Replace with authored orthographic measurements before runtime physics or production LOD budgets."
    },
    "uncertainties": [
      "The generated prompt requested three shares, while the image appears to show four; the visible reference currently wins, but count needs authored confirmation.",
      "Rear and underside geometry are inferred rather than observed.",
      "Actual hitch dimensions, hydraulic stroke, mass, and soil-contact limits are unknown.",
      "The reference is stylized and cannot establish manufacturing-grade dimensions."
    ]
  },
  "coordinateFrame": {
    "front": "toward the tractor and three-point hitch",
    "up": "world positive Y",
    "right": "implement right when facing the tractor",
    "units": "meters for authored runtime estimates; all provisional measurements carry confidence",
    "origin": "center of the attachment frame at the raised-state pivot envelope"
  },
  "components": [
    {
      "id": "root",
      "parent": null,
      "level": "macro",
      "role": "whole implement presentation root",
      "topology": {
        "class": "assembled-solid",
        "primitiveStrategy": "named child pivots and compound primitives"
      },
      "pivot": {
        "mode": "custom-attachment-origin",
        "localPosition": [0, 0, 0],
        "axis": [1, 0, 0]
      },
      "sockets": [
        {
          "id": "root-attachment-envelope",
          "position": [0, 0, 0],
          "role": "adapter alignment"
        }
      ],
      "collider": {
        "type": "compound-proxy",
        "authority": "simulation-owned; visual mesh is not a collider",
        "isTrigger": false
      },
      "materials": ["painted-steel", "bare-steel", "soil-residue"],
      "action": {
        "animationRole": "whole-implement-state",
        "states": ["raised", "lowered", "detached"],
        "detachable": true
      },
      "localFeatures": ["root-edge-wear", "root-contact-shadow"],
      "dimensions": {
        "width": 3.8,
        "height": 1.8,
        "depth": 1.35,
        "confidence": 0.3
      },
      "evidenceRefs": ["primary-reference"]
    },
    {
      "id": "attachment-frame",
      "parent": "root",
      "level": "macro",
      "role": "three-point attachment frame",
      "topology": {
        "class": "assembled-solid",
        "primitiveStrategy": "beveled box beams and pin cylinders"
      },
      "pivot": {
        "mode": "custom",
        "localPosition": [0, 0.55, 0.18],
        "axis": [1, 0, 0]
      },
      "sockets": [
        {
          "id": "top-link-socket",
          "position": [0, 1.55, 0.1],
          "role": "tractor upper link"
        },
        {
          "id": "lower-left-hitch",
          "position": [-1.25, 0.55, 0.2],
          "role": "tractor lower link"
        },
        {
          "id": "lower-right-hitch",
          "position": [1.25, 0.55, 0.2],
          "role": "tractor lower link"
        }
      ],
      "collider": {
        "type": "box",
        "authority": "simulation-owned proxy",
        "isTrigger": false
      },
      "materials": ["painted-steel", "bare-steel", "rust"],
      "action": {
        "animationRole": "attachment-root",
        "states": ["attached", "detached"],
        "detachable": true
      },
      "localFeatures": [
        "attachment-bevels",
        "hitch-fasteners",
        "rust-at-pin-seams"
      ],
      "dimensions": {
        "width": 2.8,
        "height": 1.4,
        "depth": 0.5,
        "confidence": 0.5
      },
      "evidenceRefs": ["primary-reference"]
    },
    {
      "id": "share-assembly",
      "parent": "root",
      "level": "macro",
      "role": "soil-cutting repeated system",
      "topology": {
        "class": "continuous-sculpt",
        "primitiveStrategy": "four handed helicoidal moldboard shells with section-by-section twist, depth staggering, and integrated forward cutting-share transitions"
      },
      "pivot": {
        "mode": "base-row",
        "localPosition": [0, 0.2, -0.5],
        "axis": [1, 0, 0]
      },
      "sockets": [
        {
          "id": "soil-contact-row",
          "position": [0, -0.65, -0.9],
          "role": "terrain contact envelope"
        }
      ],
      "collider": {
        "type": "compound-proxy",
        "authority": "simulation-owned terrain-tool proxy",
        "isTrigger": false
      },
      "materials": ["bare-steel", "painted-steel", "soil-residue"],
      "action": {
        "animationRole": "lowered-tool",
        "states": ["raised", "lowered", "cutting"],
        "detachable": true
      },
      "localFeatures": [
        "share-curvature",
        "cutting-edge-bevel",
        "soil-cavity-residue"
      ],
      "dimensions": {
        "width": 3.4,
        "height": 1.1,
        "depth": 1.0,
        "confidence": 0.55
      },
      "evidenceRefs": ["primary-reference"]
    },
    {
      "id": "hydraulic-ram",
      "parent": "root",
      "level": "meso",
      "role": "raise/lower actuator",
      "topology": {
        "class": "assembled-solid",
        "primitiveStrategy": "cylinders, tube, and hinge pin"
      },
      "pivot": {
        "mode": "hinge",
        "localPosition": [0, 0.95, 0.12],
        "axis": [1, 0, 0]
      },
      "sockets": [
        {
          "id": "hydraulic-upper-eye",
          "position": [0, 1.18, 0.12],
          "role": "frame hinge"
        },
        {
          "id": "hydraulic-lower-eye",
          "position": [0, 0.45, -0.35],
          "role": "beam hinge"
        }
      ],
      "collider": {
        "type": "capsule",
        "authority": "simulation-owned proxy",
        "isTrigger": false
      },
      "materials": ["bare-steel", "rust"],
      "action": {
        "animationRole": "linear-actuator",
        "states": ["retracted", "extended"],
        "detachable": true
      },
      "localFeatures": ["ram-polished-rod", "ram-rust-collar", "ram-pivot-pin"],
      "dimensions": { "length": 0.9, "diameter": 0.18, "confidence": 0.4 },
      "evidenceRefs": ["primary-reference"]
    },
    {
      "id": "top-link-bracket",
      "parent": "attachment-frame",
      "level": "meso",
      "role": "upper hitch bracket",
      "topology": {
        "class": "assembled-solid",
        "primitiveStrategy": "paired plates and pin cylinder"
      },
      "pivot": {
        "mode": "hinge",
        "localPosition": [0, 1.5, 0.1],
        "axis": [1, 0, 0]
      },
      "sockets": [
        {
          "id": "top-link-contact",
          "position": [0, 1.55, 0.1],
          "role": "tractor top-link contact"
        }
      ],
      "collider": {
        "type": "box",
        "authority": "simulation-owned proxy",
        "isTrigger": false
      },
      "materials": ["bare-steel", "rust"],
      "action": {
        "animationRole": "hinged-attachment",
        "states": ["attached", "detached"],
        "detachable": true
      },
      "localFeatures": ["top-link-pin", "top-link-bevel"],
      "evidenceRefs": ["primary-reference"]
    },
    {
      "id": "lower-left-hitch",
      "parent": "attachment-frame",
      "level": "meso",
      "role": "left lower hitch clevis",
      "topology": {
        "class": "assembled-solid",
        "primitiveStrategy": "paired plates and pin cylinder"
      },
      "pivot": {
        "mode": "hinge",